{
  "protocolVersion": "1.0",
  "type": "request",
  "requestId": "01900000-0000-7000-8000-000000000001",
  "browserId": "11111111-1111-4111-8111-111111111111",
  "command": "page.getHTML",
  "target": {
    "browserId": "11111111-1111-4111-8111-111111111111",
    "tabId": 42,
    "frameId": 0
  },
  "params": {},
  "timeoutMs": 15000
}
