{
  "protocolVersion": "1.0",
  "type": "request",
  "requestId": "01900000-0000-7000-8000-000000000002",
  "browserId": "11111111-1111-4111-8111-111111111111",
  "command": "page.click",
  "target": {
    "browserId": "11111111-1111-4111-8111-111111111111",
    "tabId": 42,
    "documentId": "document-1"
  },
  "params": {
    "locator": {
      "role": "button",
      "name": "Submit",
      "nth": 0,
      "strict": true
    }
  },
  "timeoutMs": 15000
}
