{
  "protocolVersion": "1.0",
  "type": "welcome",
  "browserId": "11111111-1111-4111-8111-111111111111",
  "connectionId": "connection-1",
  "result": {
    "browserId": "11111111-1111-4111-8111-111111111111",
    "connectionId": "connection-1",
    "serverTime": "2026-08-23T19:00:00Z",
    "credential": "abcdefghijklmnopqrstuvwxyz0123456789ABCDEFG",
    "paired": true
  }
}
